date,org_name,url,email,subject,status
2026-03-30 16:04,#ItzOnWealthTech Ep. 73: Confessions of a Fintech Heretic with Lex ...,https://wealthtechtoday.com/2020/11/12/itzonwealthtech-ep-73-confessions-of-a-fintech-heretic-with-lex-sokolin/,info@ezragroupllc.com,,generation_failed
2026-03-30 16:04,Digital Assets' Growing Role in Wealth Management - Articles,https://www.advisorperspectives.com/articles/2024/10/28/digital-assets-growing-role-wealth-management,,,scrape_failed
2026-03-30 16:04,Wealth managers remain cautious on crypto,https://www.pwmnet.com/wealth-managers-remain-cautious-on-crypto,,,no_email
2026-03-30 16:04,How Eaglebrook Advisors Integrates Crypto into Wealth Management,https://www.wealthmanagement.com/crypto/wealth-management-invest-demystifying-crypto-for-financial-advisors-with-kristin-mirabella,david.bodamer@informa.com,,generation_failed
2026-03-30 16:04,CoinShares: Investors Look to Advisors for Risk Assessment on ...,https://www.wealthmanagement.com/crypto/coinshares-investors-look-to-their-financial-advisors-for-risk-assessment-on-digital-assets,google_preferred_source_badge_dark@2x.webp,,generation_failed
2026-03-30 16:04,Crypto's Place in Financial Plans: Sorting Story from Strategy,https://tciwealth.com/blog/cryptos-place-in-financial-plans/,,,no_email
2026-03-30 16:05,The case for crypto services in wealth management - Blog - Avaloq,https://www.avaloq.com/insights/blog/the-case-for-crypto-services-in-wealth-management,info@avaloq.com,,generation_failed
2026-03-30 16:05,Digital Assets and the Future of Wealth | BitGo,https://www.bitgo.com/resources/blog/digital-assets-and-the-future-of-wealth/,support@bitgo.com,,generation_failed
2026-03-30 16:05,The Top Fintech Story of 2021: Crypto for Advisors,https://www.wealthmanagement.com/crypto/the-top-fintech-story-of-2021-crypto-for-advisors,google_preferred_source_badge_dark@2x.webp,,generation_failed
2026-03-30 16:05,Wealth Management: Strategy blog – Bitcoin as an investment?,https://www.rothschildandco.com/en/newsroom/insights/2021/01/wm-strategy-blog-bitcoin-as-an-investment/,,,scrape_failed
2026-03-30 16:17,Talking Crypto with Your Planning Clients - eMoney Advisor,https://emoneyadvisor.com/blog/talking-crypto-with-your-planning-clients/,,,no_email
2026-03-30 16:17,Global Fintech & Digital Assets Blog | Market Trends Driving ...,https://www.fintechanddigitalassets.com/,,,no_email
2026-03-30 16:17,The intersection of cryptocurrency and wealth management - Fidelity,https://clearingcustody.fidelity.com/insights/topics/running-your-business/the-intersection-of-cryptocurrency-and-wealth-management,,,no_email
2026-03-30 16:20,Crypto's Renewed Relevance For Wealth Management: Is Your Firm ...,https://www.advisorhub.com/resources/cryptos-renewed-relevance-for-wealth-management-is-your-firm-prepared/,,,scrape_failed
2026-03-30 16:20,Crypto Goes Mainstream - Morgan Stanley,https://www.morganstanley.com/insights/podcasts/thoughts-on-the-market/cryptocurrencies-going-mainstream-mike-cyprys-denny-galindo,,,no_email
2026-03-30 16:32,Crypto's Place in Financial Plans: Sorting Story from Strategy,https://tciwealth.com/blog/cryptos-place-in-financial-plans/,,,no_email
2026-03-30 16:32,Wealth managers remain cautious on crypto,https://www.pwmnet.com/wealth-managers-remain-cautious-on-crypto,,,no_email
2026-03-30 16:32,#ItzOnWealthTech Ep. 73: Confessions of a Fintech Heretic with Lex ...,https://wealthtechtoday.com/2020/11/12/itzonwealthtech-ep-73-confessions-of-a-fintech-heretic-with-lex-sokolin/,info@ezragroupllc.com,,generation_failed
2026-03-30 16:32,Digital Assets and the Future of Wealth | BitGo,https://www.bitgo.com/resources/blog/digital-assets-and-the-future-of-wealth/,support@bitgo.com,,generation_failed
2026-03-30 16:32,The case for crypto services in wealth management - Blog - Avaloq,https://www.avaloq.com/insights/blog/the-case-for-crypto-services-in-wealth-management,info@avaloq.com,,generation_failed
2026-03-30 16:33,CoinShares: Investors Look to Advisors for Risk Assessment on ...,https://www.wealthmanagement.com/crypto/coinshares-investors-look-to-their-financial-advisors-for-risk-assessment-on-digital-assets,,,scrape_failed
2026-03-30 16:33,How Eaglebrook Advisors Integrates Crypto into Wealth Management,https://www.wealthmanagement.com/crypto/wealth-management-invest-demystifying-crypto-for-financial-advisors-with-kristin-mirabella,,,scrape_failed
2026-03-30 16:33,Digital Assets' Growing Role in Wealth Management - Articles,https://www.advisorperspectives.com/articles/2024/10/28/digital-assets-growing-role-wealth-management,,,scrape_failed
2026-03-30 16:33,The Top Fintech Story of 2021: Crypto for Advisors,https://www.wealthmanagement.com/crypto/the-top-fintech-story-of-2021-crypto-for-advisors,,,scrape_failed
2026-03-30 16:33,Wealth Management: Strategy blog – Bitcoin as an investment?,https://www.rothschildandco.com/en/newsroom/insights/2021/01/wm-strategy-blog-bitcoin-as-an-investment/,,,scrape_failed
2026-03-31 05:51,Financial Services Marketing & PR Agency - Prose Media,https://www.prosemedia.com/industry/finance,swiper@12.1.2,,generation_failed
2026-03-31 05:57,Bitcoin Magazine Introduces New Short Form Opinion Format: Takes,https://cryptorank.io/news/feed/23612-bitcoin-magazine-introduces-opinion-takes,u003esupport@cryptorank.io,,generation_failed
2026-03-31 05:57,Join the CryptoBit Mag Team: Careers in Crypto Journalism,https://www.cryptobitmag.com/careers/,,,no_email
2026-03-31 05:57,Most Reliable Cryptocurrency News Sources: A Complete Guide for ...,https://www.bitget.com/academy/12560603880854,,,scrape_failed
2026-03-31 05:57,Answering the Zweig Questions: Evaluating Financial Planners,https://www.mywealthplanners.com/2022/11/08/answering-the-zweig-questions/,,,no_email
2026-03-31 05:57,From Struggling To $115M AUM By Finding The Right Niche,https://www.kitces.com/blog/financial-advisor-succession-marketing-niche-target-client-smartasset/,,,no_email
2026-03-31 06:03,"Kevin Cott, Author at Cott Law Group",https://cottlawgroup.com/author/kevin-cott/,hello@cottlawgroup.com,,generation_failed
2026-03-31 06:03,Blog - David Denniston,https://www.daviddenniston.com/blog,,,scrape_failed
2026-03-31 06:09,"Crypto magazine published by Japanese polular Publisher ""Futaba ...",https://projectcatalyst.io/funds/10/developer-ecosystem-the-evolution/crypto-magazine-published-by-japanese-polular-publisher-futaba-sha,ranket2ranktpool@gmail.com,,generation_failed
2026-03-31 06:15,How Artificial Intelligence May Impact the Accounting Profession,https://www.cpajournal.com/2025/09/08/how-artificial-intelligence-may-impact-the-accounting-profession/,CPAJ-Editors@nysscpa.org,,generation_failed
2026-03-31 06:15,8 Best Crypto Newsletters 2025: Free Daily Crypto Emails - Milk Road,https://milkroad.com/newsletter/,,,scrape_failed
2026-03-31 06:15,Crypto & Digital Assets in Disputes Series | Thought Leaders 4,https://thoughtleaders4.com/index.php/tl4-fire/event-series-details/crypto-digital-assets-in-disputes-series,,,scrape_failed
2026-03-31 06:15,Crypto News Websites: Best Bitcoin & Blockchain Sites,https://masterthecrypto.com/cryptocurrency-news-websites/,,,no_email
2026-03-31 06:21,Family Business Director Blog - Mercer Capital,https://mercercapital.com/insights/blogs/family-business-director-blog/,harmst@mercercapital.com,,generation_failed
2026-03-31 06:28,Has PayPal's Solana Expansion Helped Its Stablecoin's Price?,https://pressbooks.cuny.edu/learners/part/has-paypals-solana-expansion-helped-its-stablecoins-price/,2d4f5b0b777a4a4baeb7ef0bdd18dd1f@o361675.ingest.sentry.io,,generation_failed
2026-03-31 06:34,The Core Issue: Letter From The Editor - Bitcoin Magazine,https://bitcoinmagazine.com/print/the-core-issue-letter-from-the-editor,editor@bitcoinmagazine.com,,generation_failed
2026-03-31 06:40,"FinTech, Blockchain, and Cryptocurrency - Cornerstone Research",https://www.cornerstone.com/practices/industries/fintech-blockchain-cryptocurrency/,media@cornerstone.com,,generation_failed
2026-03-31 08:54,Digital Assets and Cryptocurrency Regulation: A Roadmap for ...,https://papers.ssrn.com/sol3/papers.cfm?abstract_id=5585310,,,scrape_failed
2026-03-31 08:55,Getting Down to Business with Bitcoin - Sooner Magazine,http://soonermag.oufoundation.org/stories/getting-down-to-busienss-with-bitcoin,soonermagazine@oufoundation.org,Exclusive: How OU Students Should Think About Bitcoin—Beyond the Headlines,sent
2026-03-31 08:55,Most Reliable Cryptocurrency News Sources: A Complete Guide for ...,https://www.bitget.com/ru/academy/12560603880854,,,scrape_failed
2026-03-31 08:55,Daniel Ferreira - The Myths of Blockchain Governance - SSRN,https://www.ssrn.com/abstract=5423997,,,scrape_failed
2026-03-31 08:55,[PDF] Exploring Crypto & Blockchain in Finance: Present & Future - SSRN,https://papers.ssrn.com/sol3/Delivery.cfm/SSRN_ID4787238_code2129018.pdf?abstractid=4787238&mirid=1&type=2,,,scrape_failed
2026-03-31 08:55,Financial Economics Network - SSRN,https://www.ssrn.com/index.cfm/en/fen/?page=1&sort=0&term=crypto,,,scrape_failed
2026-03-31 08:56,The Core Issue: Letter From The Editor - Bitcoin Magazine,https://bitcoinmagazine.com/print/the-core-issue-letter-from-the-editor,editor@bitcoinmagazine.com,Exclusive: Why Bitcoin Core Developers Need to Understand India's VDA Tax Framework (And Why It Matters Globally),sent
2026-03-31 08:56,"Crypto magazine published by Japanese polular Publisher ""Futaba ...",https://projectcatalyst.io/funds/10/developer-ecosystem-the-evolution/crypto-magazine-published-by-japanese-polular-publisher-futaba-sha,ranket2ranktpool@gmail.com,Exclusive Research: Cardano's Tax Advantage in Japan + Why Institutional Investors Are Shifting to Crypto Derivatives,sent
2026-03-31 08:56,Blockchain Technology and the Quest for an Open Financial System,https://www.ssrn.com/abstract=3418557,,,scrape_failed
2026-03-31 08:56,8 Best Crypto Newsletters 2025: Free Daily Crypto Emails - Milk Road,https://milkroad.com/newsletter/,,,scrape_failed
2026-03-31 08:57,"FinTech, Blockchain, and Cryptocurrency - Cornerstone Research",https://www.cornerstone.com/practices/industries/fintech-blockchain-cryptocurrency/,media@cornerstone.com,Exclusive: How Blockchain Evidence Standards Are Reshaping Crypto Litigation Strategy,sent
2026-03-31 08:57,Join the CryptoBit Mag Team: Careers in Crypto Journalism,https://www.cryptobitmag.com/careers/,,,no_email
2026-03-31 08:57,The Impact of Blockchain Technology on Financial Regulations and ...,https://papers.ssrn.com/sol3/papers.cfm?abstract_id=4521762,,,scrape_failed
2026-03-31 08:57,Blockchain And the Revolution in Building Digital Trust,https://papers.ssrn.com/sol3/papers.cfm?abstract_id=5657070,,,scrape_failed
2026-03-31 08:57,"The New Golden Age of Finance: Bitcoin, Cryptocurrency, and ...",https://www.ssrn.com/abstract=5170249,,,scrape_failed
2026-03-31 08:58,Bitcoin Magazine Introduces New Short Form Opinion Format: Takes,https://cryptorank.io/news/feed/23612-bitcoin-magazine-introduces-opinion-takes,support@cryptorank.io,Exclusive Research: Why Bitcoin Magazine Readers Need to Understand Crypto Derivatives Tax Strategy (India Case Study),sent
2026-03-31 08:58,Cryptocurrency Research Hub - SSRN,https://www.ssrn.com/index.cfm/en/cryptocurrency/,,,scrape_failed
2026-03-31 08:58,Blockchain Technology for Traditional Finance,https://papers.ssrn.com/sol3/papers.cfm?abstract_id=6425011,,,scrape_failed
